Title,Movie ID,Genre,Production Company,Budget,Revenue,Overview,Release Date
The Princess and the Frog,10198,Romance,Walt Disney Pictures,105000000,270997378,"A waitress, desperate to fulfill her dreams as a restaurant owner, is set on a journey to turn a frog prince back into a human being, but she has to face the same problem after she kisses him.",2009-12-08
Hotel for Dogs,15189,Comedy,Nickelodeon Movies,35000000,73034460,"Placed in a foster home that doesn't allow pets, 16-year-old Andi and her younger brother, Bruce, turn an abandoned hotel into a home for their dog. Soon other strays arrive, and the hotel becomes a haven for every orphaned canine in town. But the kids have to do some quick thinking to keep the cops off their tails.",2009-01-16
Where the Wild Things Are,16523,Family,Legendary Pictures,100000000,100086793,"Max imagines running away from his mom and sailing to a far-off land where large talking beasts -- Ira, Carol, Douglas, the Bull, Judith and Alexander -- crown him as their king, play rumpus, build forts and discover secret hideaways.",2009-10-16
Broken Embraces,8088,Drama,Sony Pictures,18000000,0,"Harry Caine, a blind writer, reaches this moment in time when he has to heal his wounds from 14 years back. He was then still known by his real name, Mateo Blanco, and directing his last movie.",2009-03-01
Universal Soldier: Regeneration,28510,Adventure,Foresight Unlimited,14000000,875386,"When terrorists threaten nuclear catastrophe, the world's only hope is to reactivate decommissioned Universal Soldier Luc Deveraux. Rearmed and reprogrammed, Deveraux must take on his nemesis from the original Universal Soldier and a next-generation ""UniSol"".",2009-10-01
Astro Boy,16577,Animation,Tezuka Production Company Ltd.,10000000,19551067,"Set in the futuristic Metro City, Astro Boy (Atom) is a young robot with incredible powers created by a brilliant scientist in the image of the son he had lost. Unable to fulfill his creator's expectations, Astro embarks on a journey in search of acceptance, experiencing betrayal and a netherworld of robot gladiators, before returning to save Metro City and reconcile with the father who rejected him.",2009-10-15
Carriers,25769,Action,Paramount Vantage,0,5802422,"Four friends fleeing a viral pandemic soon learn they are more dangerous than any virus.A deadly virus has spread across the globe. Contagion is everywhere, no one is safe and no one can be trusted. Four young attractive people race through the back roads of the American West to the pounding beat of a vacation soundtrack. Their aim is to retreat to secluded utopian beach in the Gulf of Mexico, where they could peacefully wait out the pandemic and survive the apocalyptic disease. Their plans take a grim turn when their car breaks down on an isolated road starting a chain of events that will seal the fate of each of them in an inexorable and horrifying voyage of hell through a western landscape populated by only the hideous dead or the twisted living.",2009-09-04
Capitalism: A Love Story,22074,Documentary,The Weinstein Company,20000000,17436509,"Michael Moore's Capitalism: A Love Story comes home to the issue he's been examining throughout his career: the disastrous impact of corporate dominance on the everyday lives of Americans (and by default, the rest of the world).",2009-09-06
The Joneses,41479,Comedy,Echo Lake Productions,10000000,7022728,"A seemingly perfect family moves into a suburban neighborhood, but when it comes to the truth as to why they're living there, they don't exactly come clean with their neighbors.",2009-09-13
Mary and Max,24238,Animation,icon,590235,1725381,"A tale of friendship between two unlikely pen pals: Mary, a lonely, eight-year-old girl living in the suburbs of Melbourne, and Max, a forty-four-year old, severely obese man living in New York. In the mid-1970's, a homely, friendless Australian girl of 8 picks a name out of a Manhattan phone book and writes to him; she includes a chocolate bar. He writes back, with chocolate. Thus begins a 20-year correspondence. Will the two ever meet face to face?",2009-02-09
According to Greta,26035,Drama,Whitewater Films,0,0,"Greta is a waitress who falls for an ambitious cook at the restaurant where they work. But as their summer romance heats up, she has to overcome the concerns of her grandparents about her boyfriend's criminal past.",2009-11-25
Spread,19918,Comedy,Oceana Media Finance,0,12032983,"In Los Angeles, Nikki is homeless, car-less and closing in on 30, but he's amoral, good-looking, and adept in the sack, moving from one wealthy woman of 35 or 40 to another, a kept boy-toy. His newest gig, with Samantha, an attorney whose house overlooks L.A., is sweet, although it's unclear how long she'll put up with him. Then Nikki meets Heather, a waitress. Is the player being played, or might this be love? What will Nikki discover?",2009-01-16
Race to Witch Mountain,13836,Adventure,Walt Disney Pictures,50000000,106303988,"A taxi driver gets more than he bargained for when he picks up two teen runaways. Not only does the pair possess supernatural powers, but they're also trying desperately to escape people who have made them their targets.",2009-03-12
Prayers for Bobby,21634,Drama,Daniel Sladek Entertainment,0,0,"True story of Mary Griffith, gay rights crusader, whose teenage son committed suicide due to her religious intolerance. Based on the book of the same title by Leroy Aarons.",2009-02-27
Oceans,36970,Documentary,Disneynature,0,19406406,"An ecological drama/documentary, filmed throughout the globe. Part thriller, part meditation on the vanishing wonders of the sub-aquatic world.",2009-10-17
The Men Who Stare at Goats,10313,Comedy,Ruby Films,24000000,68729358,"A reporter in Iraq might just have the story of a lifetime when he meets Lyn Cassady, a guy who claims to be a former member of the U.S. Army's New Earth Army, a unit that employs paranormal powers in their missions.",2009-10-17
Love Happens,25643,Drama,Stuber Productions,18000000,36133014,"Dr. Burke Ryan is a successful self-help author and motivational speaker with a secret. While he helps thousands of people cope with tragedy and personal loss, he secretly is unable to overcome the death of his late wife. It's not until Burke meets a fiercely independent florist named Eloise that he is forced to face his past and overcome his demons.",2009-09-18
World's Greatest Dad,20178,Comedy,Magnolia Pictures,10000000,295750,"In the wake of a freak accident, Lance suffers the worst tragedy and the greatest opportunity of his life. He is suddenly faced with the possibility of fame, fortune and popularity, if he can only live with the knowledge of how he got there.",2009-08-20
Case 39,28355,Horror,Paramount Vantage,27000000,29000000,"In her many years as a social worker, Emily Jenkins believes she has seen it all, until she meets 10-year-old Lilith and the girl's cruel parents. Emily's worst fears are confirmed when the parents try to harm the child, and so Emily assumes custody of Lilith while she looks for a foster family. However, Emily soon finds that dark forces surround the seemingly innocent girl, and the more she tries to protect Lilith, the more horrors she encounters.",2009-08-13
Post Grad,25704,Comedy,The Montecito Picture Company,15000000,6405245,"Ryden Malby has a master plan. Graduate college, get a great job, hang out with her best friend and find the perfect guy. But her plan spins hilariously out of control when she’s forced to move back home with her eccentric family.",2009-08-21
In the Loop,19833,Comedy,Aramid Entertainment Fund,0,6149791,"The US President and the UK Prime Minister are looking to launch a war in the Middle East. The plot follows government officials and advisers in their behind-the-scenes efforts either to promote the war or prevent it. Spinal Tap meets Strangelove. A satirical demolition of Whitehall and Washington: politically astute, hilarious and terrifyingly real.",2009-01-22
Beyond a Reasonable Doubt,25137,Crime,Aramid Entertainment Fund,25000000,4388563,Remake of a 1956 Fritz Lang film in which a novelist's investigation of a dirty district attorney leads to a setup within the courtroom.,2009-02-05
Enter the Void,34647,Fantasy,BIM Distribuzione,13000000,754249,"This psychedelic tour of life after death is seen entirely from the point of view of Oscar (Nathaniel Brown), a young American drug dealer and addict living in Tokyo with his prostitute sister, Linda (Paz de la Huerta). When Oscar is killed by police during a bust gone bad, his spirit journeys from the past -- where he sees his parents before their deaths -- to the present -- where he witnesses his own autopsy -- and then to the future, where he looks out for his sister from beyond the grave.",2009-05-05
Confessions of a Shopaholic,20048,Comedy,Touchstone Pictures,40000000,108332743,"In the glamorous world of New York City, Rebecca Bloomwood is a fun-loving girl who is really good at shopping-a little too good, perhaps. She dreams of working for her favorite fashion magazine, but can't quite get her foot in the door-until ironically, she snags a job as an advice columnist for a financial magazine published by the same company.",2009-02-05
Street Fighter: The Legend of Chun-Li,15268,Action,Hyde Park Films,50000000,12764201,"When a teenager, Chun-Li witnesses the kidnapping of her father by wealthy crime lord M. Bison. When she grows up, she goes into a quest for vengeance and becomes the famous crime-fighter of the Street Fighter universe.",2009-02-27
Bodyguards and Assassins,30596,Drama,China Film Group Corporation,23000000,5837674,"In 1905, revolutionist Sun Yat-Sen visits Hong Kong to discuss plans with Tongmenghui members to overthrow the Qing dynasty. But when they find out that assassins have been sent to kill him, they assemble a group of protectors to prevent any attacks.",2009-12-18
Taking Woodstock,26320,Music,Focus Features,0,0,"The story of Elliot Tiber and his family, who inadvertently played a pivotal role in making the famed Woodstock Music and Arts Festival into the happening that it was. When Elliot hears that a neighboring town has pulled the permit on a hippie music festival, he calls the producers thinking he could drum up some much-needed business for his parents' run-down motel. Three weeks later, half a million people are on their way to his neighbor’s farm in White Lake, New York, and Elliot finds himself swept up in a generation-defining experience that would change his life–and American culture–forever.",2009-09-03
Home,62320,Documentary,France 2 (FR2),0,0,"With aerial footage from 54 countries, Home is a depiction of how the Earth's problems are all interlinked.",2009-06-03
The Stepfather,19904,Horror,Screen Gems,0,0,"Michael Harding (Penn Badgley) returns home from military school to find his mother (Sela Ward) happily in love and living with her new boyfriend, David (Dylan Walsh). As the two men get to know each other, Michael becomes more and more suspicious of the man who is always there with a helpful hand. Is he really the man of her dreams or could David be hiding a dark side?",2009-10-16
Youth in Revolt,22327,Drama,Dimension Films,18000000,0,"As a fan of Albert Camus and Jean-Luc Godard, teenage Nick Twisp is definitely out of his element when his mother and her boyfriend move the family to a trailer park. When a pretty neighbor named Sheeni plays records by French crooners, it's love at first sight for frustrated and inexperienced Nick. Learning that she is dating someone, Nick launches a hilarious quest to find his way into Sheeni's heart -- and bed.",2009-09-11
Miss March,19556,Comedy,The Jacobson Company,0,0,A young man awakens from a four-year coma to hear that his once virginal high-school sweetheart has since become a centerfold in one of the world's most famous men's magazines. He and his sex-crazed best friend decide to take a cross-country road trip in order to crash a party at the magazine's legendary mansion headquarters and win back the girl.,2009-03-13
The Hedgehog,19597,Comedy,Eagle Pictures,0,0,"Paloma is a serious and highly articulate but deeply bored 11-year-old who has decided to kill herself on her 12th birthday. Fascinated by art and philosophy, she questions and documents her life and immediate circle, drawing trenchant and often hilarious observations on the world around her. But as her appointment with death approaches, Paloma finally meets some kindred spirits in her building's grumpy janitor and an enigmatic, elegant neighbor, both of whom inspire Paloma to question her rather pessimistic outlook on life.",2009-07-03
Ninja Assassin,22832,Action,Medienboard Berlin-Brandenburg,40000000,60462347,"Ninja Assassin follows Raizo (Rain), one of the deadliest assassins in the world. Taken from the streets as a child, he was transformed into a trained killer by the Ozunu Clan, a secret society whose very existence is considered a myth. But haunted by the merciless execution of his friend by the Clan, Raizo breaks free from them and vanishes. Now he waits, preparing to exact his revenge.",2009-09-29
Thirst,22536,Drama,Moho Films,5000000,0,"Sang-hyun (Song Kang-ho), a respected priest, volunteers for an experimental procedure that may lead to a cure for a deadly virus. He gets infected and dies, but a blood transfusion of unknown origin brings him back to life as a vampire. Now, Sang-hyun is torn between faith and bloodlust, and has a newfound desire for Tae-ju (Kim Ok-vin), the wife of his childhood friend.",2009-04-30
Red Cliff Part II,15384,Action,Showbox,80000000,121059225,"The battle of Red Cliff continues and the alliance between Xu and East Wu is fracturing.  With Cao Cao's massive forces on their doorstep, will the kingdoms of Xu and East Wu survive?",2009-01-07
State of Play,16995,Thriller,Andell Entertainment,60000000,87784194,"Handsome, unflappable U.S. Congressman Stephen Collins is the future of his political party: an honorable appointee who serves as the chairman of a committee overseeing defense spending. All eyes are upon the rising star to be his party's contender for the upcoming presidential race. Until his research assistant/mistress is brutally murdered and buried secrets come tumbling out.",2009-04-17
Partly Cloudy,24480,Animation,Pixar,0,0,"Everyone knows that the stork delivers babies, but where do the storks get the babies from? The answer lies up in the stratosphere, where cloud people sculpt babies from clouds and bring them to life. Gus, a lonely and insecure grey cloud, is a master at creating ""dangerous"" babies. Crocodiles, porcupines, rams and more - Gus's beloved creations are works of art, but more than a handful for his loyal delivery stork partner, Peck. As Gus's creations become more and more rambunctious, Peck's job gets harder and harder. How will Peck manage to handle both his hazardous cargo and his friend's fiery temperament?",2009-05-28
Spanish Movie,35640,Comedy,Telecinco Cinema,33000000,6982465,"Grandes dosis de humor, ingeniosos guiños a nuestro cine patrio más reciente, un elenco artístico altamente ligado a la comedia y una elevada reserva de sorpresas constituyen los ingredientes de esta disparatada comedia: Spanish Movie.",2009-12-04
The Damned United,21641,Drama,BBC Films,10000000,0,"Taking over Leeds United, Brian Clough's abrasive approach and his clear dislike of the players' dirty style of play make it certain there is going to be friction. Glimpses of his earlier career help explain both his hostility to previous manager Don Revie and how much he is missing right-hand man Peter Taylor",2009-03-27
Veronika Decides to Die,25968,Drama,PalmStar Media,9000000,0,"After a frantic suicide attempt, Veronika awakens inside a mysterious mental asylum. Under the supervision of an unorthodox psychiatrist who specializes in controversial treatment, Veronika learns that she has only weeks to live.",2009-05-16
Ninja,25602,Action,Millennium Films,10000000,0,"A westerner named Casey, studying Ninjutsu in Japan, is asked by the Sensei to return to New York to protect the legendary Yoroi Bitsu, an armored chest that contains the weapons of the last Koga Ninja.",2009-10-22
Brooklyn's Finest,26390,Crime,Thunder Road Productions,17000000,36440201,Enforcing the law within the notoriously rough Brownsville section of the city and especially within the Van Dyke housing projects is the NYPD's sixty-fifth precinct. Three police officers struggle with the sometimes fine line between right and wrong.,2009-01-16
My Life in Ruins,23049,Comedy,Fox Searchlight Pictures,17000000,20455276,"A Greek tour guide named Georgia attempts to recapture her kefi (Greek for mojo) by guiding a ragtag group of tourists around Greece and showing them the beauty of her native land. Along the way, she manages to open their eyes to the wonders of an exotic foreign land while beginning to see the world through a new set of eyes in the process.",2009-02-06
Transformers: Revenge of the Fallen,8373,Science Fiction,Hasbro Studios,150000000,836297228,"Sam Witwicky leaves the Autobots behind for a normal life. But when his mind is filled with cryptic symbols, the Decepticons target him and he is dragged back into the Transformers' war.",2009-06-19
Crazy Heart,25196,Drama,Fox Searchlight Pictures,7000000,47405566,"When reporter Jean Craddock interviews Bad Blake -- an alcoholic, seen-better-days country music legend -- they connect, and the hard-living crooner sees a possible saving grace in a life with Jean and her young son. But can he leave behind an existence playing in the shadow of Tommy, the upstart kid he once mentored?",2009-12-16
Sorority Row,26688,Horror,Karz Entertainment,12500000,27206120,"When five sorority girls inadvertently cause the murder of one of their sisters in a prank gone wrong, they agree to keep the matter to themselves and never speak of it again, so they can get on with their lives. This proves easier said than done, when after graduation a mysterious killer goes after the five of them and anyone who knows their secret.",2009-09-09
I Am Love,41110,Drama,Rai Cinema,0,0,"Emma left Russia to live with her husband in Italy. Now a member of a powerful industrial family, she is the respected mother of three, but feels unfulfilled. One day, Antonio, a talented chef and her son's friend, makes her senses kindle.",2009-09-05
Labor Pains,19794,Comedy,Grand Army Entertainment,0,0,"A young woman pretends to be pregnant in order to avoid being fired from her job. When that gets her a bunch of special treatment by everyone involved in her life, she tries to keep up the lie for nine months.",2009-07-19
Adam,22051,Drama,Olympus Pictures,0,2277396,"Adam, a lonely man with Asperger's Syndrome, develops a relationship with his upstairs neighbor, Beth.",2009-07-29
Old Dogs,22949,Comedy,Walt Disney Pictures,35000000,92219310,"Charlie and Dan have been best friends and business partners for thirty years; their Manhattan public relations firm is on the verge of a huge business deal with a Japanese company. With two weeks to sew up the contract, Dan gets a surprise: a woman he married on a drunken impulse nearly nine years before (annulled the next day) shows up to tell him he's the father of her twins, now seven, and she'll be in jail for 14 days for a political protest. Dan volunteers to keep the tykes, although he's up tight and clueless. With Charlie's help is there any way they can be dad and uncle, meet the kids' expectations, and still land the account?",2009-11-24
Pontypool,23963,Horror,Ponty Up Pictures,1500000,32000,"When disc jockey Grant Mazzy reports to his basement radio station in the Canadian town of Pontypool, he thinks it's just another day at work. But when he hears reports of a virus that turns people into zombies, Mazzy barricades himself in the radio booth and tries to figure out a way to warn his listeners about the virus and its unlikely mode of transmission.",2009-03-06
A Serious Man,12573,Comedy,Mike Zoss Productions,7000000,31430334,"A Serious Man is the story of an ordinary man's search for clarity in a universe where Jefferson Airplane is on the radio and F-Troop is on TV. It is 1967, and Larry Gopnik, a physics professor at a quiet Midwestern university, has just been informed by his wife Judith that she is leaving him. She has fallen in love with one of his more pompous acquaintances Sy Ableman.",2009-10-02
Did You Hear About the Morgans?,24438,Comedy,Banter,58000000,85280250,"In New York City, an estranged couple who witness a murder are relocated to small-town Wyoming as part of a witness-protection program.",2009-12-17
Merry Madagascar,25472,Family,DreamWorks Animation,0,0,"The Zoosters are back in an all-new holiday adventure. When Santa and his reindeer crash onto the island of Madagascar it's up to Alex, Marty, Gloria, Melman and those wacky penguins to save Christmas. Get ready for a sleigh full of laughs in this hilarious new holiday classic.",2009-11-16
Damage,24832,Action,"Nasser Group, North",0,0,"An ex-con battles it out in the cage to pay for the operation that would save the daughter of his victim. Along the way he finds fatherly love, and friendship, in the most unlikely of places.",2009-10-05
An Education,24684,Drama,BBC Films,7500000,26096852,"A coming-of-age story about a teenage girl in 1960s suburban London, and how her life changes with the arrival of a playboy nearly twice her age.",2009-10-29
The Disappearance of Alice Creed,38542,Crime,CinemaNX,800000,867714,A rich man's daughter is held captive in an abandoned apartment by two former convicts who abducted her and hold her ransom in exchange for her father's money.,2009-09-12
The King's Speech,45269,Drama,The Weinstein Company,15000000,414211549,"The King's Speech tells the story of the man who became King George VI, the father of Queen Elizabeth II. After his brother abdicates, George ('Bertie') reluctantly assumes the throne. Plagued by a dreaded stutter and considered unfit to be king, Bertie engages the help of an unorthodox speech therapist named Lionel Logue. Through a set of unexpected techniques, and as a result of an unlikely friendship, Bertie is able to find his voice and boldly lead the country into war.",2010-09-06
Kick-Ass,23483,Action,Marv Films,28000000,96188903,"Dave Lizewski is an unnoticed high school student and comic book fan who one day decides to become a super-hero, even though he has no powers, training or meaningful reason to do so.",2010-03-22
Scott Pilgrim vs. the World,22538,Action,Universal Pictures,60000000,47664559,"Scott Pilgrim is a 23 year old Canadian slacker and wannabe rockstar who falls in love with an American delivery girl, Ramona V. Flowers, and must defeat her seven ""evil exes"" to be able to date her.",2010-07-27
The Social Network,37799,Drama,Columbia Pictures,40000000,224920315,"On a fall night in 2003, Harvard undergrad and computer programming genius Mark Zuckerberg sits down at his computer and heatedly begins working on a new idea. In a fury of blogging and programming, what begins in his dorm room as a small site among friends soon becomes a global social network and a revolution in communication. A mere six years and 500 million friends later, Mark Zuckerberg is the youngest billionaire in history... but for this entrepreneur, success leads to both personal and legal complications.",2010-09-30
Salt,27576,Action,Wintergreen Productions,110000000,293329073,"As a CIA officer, Evelyn Salt swore an oath to duty, honor and country. Her loyalty will be tested when a defector accuses her of being a Russian spy. Salt goes on the run, using all her skills and years of experience as a covert operative to elude capture. Salt's efforts to prove her innocence only serve to cast doubt on her motives, as the hunt to uncover the truth behind her identity continues and the question remains: ""Who is Salt?""",2010-07-21
Insidious,49018,Horror,Stage 6 Films,1500000,97009150,"A family discovers that dark spirits have invaded their home after their son inexplicably falls into an endless sleep. When they reach out to a professional for help, they learn things are a lot more personal than they thought.",2010-09-13
Percy Jackson & the Olympians: The Lightning Thief,32657,Adventure,TCF Vancouver Productions,95000000,226497209,"Accident prone teenager, Percy discovers he's actually a demi-God, the son of Poseidon, and he is needed when Zeus' lightning is stolen. Percy must master his new found skills in order to prevent a war between the Gods that could devastate the entire world.",2010-02-01
Clash of the Titans,18823,Adventure,The Zanuck Company,125000000,232713139,"Born of a god but raised as a man, Perseus is helpless to save his family from Hades, vengeful god of the underworld. With nothing to lose, Perseus volunteers to lead a dangerous mission to defeat Hades before he can seize power from Zeus and unleash hell on earth. Battling unholy demons and fearsome beasts, Perseus and his warriors will only survive if Perseus accepts his power as a god, defies fate and creates his own destiny.",2010-04-01
Shutter Island,11324,Drama,Appian Way,80000000,294804195,"World War II soldier-turned-U.S. Marshal Teddy Daniels investigates the disappearance of a patient from a hospital for the criminally insane, but his efforts are compromised by his troubling visions and also by a mysterious doctor.",2010-02-18
TRON: Legacy,20526,Adventure,Revolution Sun Studios,170000000,400062763,"Sam Flynn, the tech-savvy and daring son of Kevin Flynn, investigates his father's disappearance and is pulled into The Grid. With the help of a mysterious program named Quorra, Sam quests to stop evil dictator Clu from crossing into the real world.",2010-12-10
