Title,Movie ID,Genre,Production Company,Budget,Revenue,Overview,Release Date
The Dark Knight Rises,49026,Action,Syncopy,250000000,1084939099,"Following the death of District Attorney Harvey Dent, Batman assumes responsibility for Dent's crimes to protect the late attorney's reputation and is subsequently hunted by the Gotham City Police Department. Eight years later, Batman encounters the mysterious Selina Kyle and the villainous Bane, a new terrorist leader who overwhelms Gotham's finest. The Dark Knight resurfaces to protect a city that has branded him an enemy.",2012-07-16
The Amazing Spider-Man,1930,Action,Columbia Pictures,215000000,752215857,"Peter Parker is an outcast high schooler abandoned by his parents as a boy, leaving him to be raised by his Uncle Ben and Aunt May. Like most teenagers, Peter is trying to figure out who he is and how he got to be the person he is today. As Peter discovers a mysterious briefcase that belonged to his father, he begins a quest to understand his parents' disappearance – leading him directly to Oscorp and the lab of Dr. Curt Connors, his father's former partner. As Spider-Man is set on a collision course with Connors' alter ego, The Lizard, Peter will make life-altering choices to use his powers and shape his destiny to become a hero.",2012-06-27
Skyfall,37724,Action,Danjaq,200000000,1108561013,"When Bond's latest assignment goes gravely wrong and agents around the world are exposed, MI6 is attacked forcing M to relocate the agency. These events cause her authority and position to be challenged by Gareth Mallory, the new Chairman of the Intelligence and Security Committee. With MI6 now compromised from both inside and out, M is left with one ally she can trust: Bond. 007 takes to the shadows - aided only by field agent, Eve - following a trail to the mysterious Silva, whose lethal and hidden motives have yet to reveal themselves.",2012-10-25
Django Unchained,68718,Drama,The Weinstein Company,100000000,425368238,"With the help of a German bounty hunter, a freed slave sets out to rescue his wife from a brutal Mississippi plantation owner.",2012-12-25
The Hobbit: An Unexpected Journey,49051,Adventure,Warner Bros. Pictures,250000000,1021103568,"Bilbo Baggins, a hobbit enjoying his quiet life, is swept into an epic quest by Gandalf the Grey and thirteen dwarves who seek to reclaim their mountain home from Smaug, the dragon.",2012-11-26
The Twilight Saga: Breaking Dawn - Part 2,50620,Adventure,Sunswept Entertainment,120000000,829000000,"After the birth of Renesmee, the Cullens gather other vampire clans in order to protect the child from a false allegation that puts the family in front of the Volturi.",2012-11-13
Ice Age: Continental Drift,57800,Animation,Twentieth Century Fox Animation,95000000,877244782,"Manny, Diego, and Sid embark upon another adventure after their continent is set adrift. Using an iceberg as a ship, they encounter sea creatures and battle pirates as they explore a new world.",2012-06-26
Wreck-It Ralph,82690,Family,Walt Disney Animation Studios,165000000,471222889,"Wreck-It Ralph is the 9-foot-tall, 643-pound villain of an arcade video game named Fix-It Felix Jr., in which the game's titular hero fixes buildings that Ralph destroys. Wanting to prove he can be a good guy and not just a villain, Ralph escapes his game and lands in Hero's Duty, a first-person shooter where he helps the game's hero battle against alien invaders. He later enters Sugar Rush, a kart racing game set on tracks made of candies, cookies and other sweets. There, Ralph meets Vanellope von Schweetz who has learned that her game is faced with a dire threat that could affect the entire arcade, and one that Ralph may have inadvertently started.",2012-11-01
Prometheus,70981,Science Fiction,Dune Entertainment,130000000,403170142,"A team of explorers discover a clue to the origins of mankind on Earth, leading them on a journey to the darkest corners of the universe. There, they must fight a terrifying battle to save the future of the human race.",2012-05-30
Life of Pi,87827,Adventure,Fox 2000 Pictures,120000000,609016565,"The story of an Indian boy named Pi, a zookeeper's son who finds himself in the company of a hyena, zebra, orangutan, and a Bengal tiger after a shipwreck sets them adrift in the Pacific Ocean.",2012-11-20
Les Misérables,82695,History,Working Title Films,61000000,441809770,"An adaptation of the successful stage musical based on Victor Hugo's classic novel set in 19th-century France, in which a paroled prisoner named Jean Valjean seeks redemption.",2012-12-18
The Expendables 2,76163,Action,Nu Image Films,100000000,312573423,"Mr. Church reunites the Expendables for what should be an easy paycheck, but when one of their men is murdered on the job, their quest for revenge puts them deep in enemy territory and up against an unexpected threat.",2012-08-08
Madagascar 3: Europe's Most Wanted,80321,Animation,DreamWorks Animation,145000000,746921274,"Animal pals Alex, Marty, Melman, and Gloria are still trying to make it back to New York's Central Park Zoo. They are forced to take a detour to Europe to find the penguins and chimps who broke the bank at a Monte Carlo casino. When French animal-control officer Capitaine Chantel DuBois picks up their scent, Alex and company are forced to hide out in a traveling circus.",2012-06-06
Flight,87502,Drama,Parkes/MacDonald Productions,31000000,161772375,"Commercial airline pilot Whip Whitaker has a problem with drugs and alcohol, though so far he's managed to complete his flights safely. His luck runs out when a disastrous mechanical malfunction sends his plane hurtling toward the ground. Whip pulls off a miraculous crash-landing that results in only six lives lost. Shaken to the core, Whip vows to get sober -- but when the crash investigation exposes his addiction, he finds himself in an even worse situation.",2012-11-02
Men in Black 3,41154,Action,Amblin Entertainment,225000000,624026776,"Agents J (Will Smith) and K (Tommy Lee Jones) are back...in time. J has seen some inexplicable things in his 15 years with the Men in Black, but nothing, not even aliens, perplexes him as much as his wry, reticent partner. But when K's life and the fate of the planet are put at stake, Agent J will have to travel back in time to put things right. J discovers that there are secrets to the universe that K never told him - secrets that will reveal themselves as he teams up with the young Agent K (Josh Brolin) to save his partner, the agency, and the future of humankind.",2012-05-23
The Grey,75174,Action,Open Road Films,25000000,77278331,An oil drilling team struggles to survive after a plane crash strands them in the wilds of Alaska. Hunting them is a pack of wolves that sees them as intruders.,2012-01-26
End of Watch,77016,Crime,5150 Action,7000000,48126384,Two young officers are marked for death after confiscating a small cache of money and firearms from the members of a notorious cartel during a routine traffic stop.,2012-09-20
The Impossible,80278,Thriller,Summit Entertainment,42000000,180274123,"In December 2004, close-knit family Maria, Henry and their three sons begin their winter vacation in Thailand. But the day after Christmas, the idyllic holiday turns into an incomprehensible nightmare when a terrifying roar rises from the depths of the sea, followed by a wall of black water that devours everything in its path. Though Maria and her family face their darkest hour, unexpected displays of kindness and courage ameliorate their terror.",2012-09-09
Abraham Lincoln: Vampire Hunter,72331,Action,Bazelevs Production,69000000,0,"President Lincoln's mother is killed by a supernatural creature, which fuels his passion to crush vampires and their slave-owning helpers.",2012-06-20
21 Jump Street,64688,Action,Stephen J. Cannell Productions,42000000,201585328,"In high school, Schmidt was a dork and Jenko was the popular jock. After graduation, both of them joined the police force and ended up as partners riding bicycles in the city park. Since they are young and look like high school students, they are assigned to an undercover unit to infiltrate a drug ring that is supplying high school students synthetic drugs.",2012-03-12
Chronicle,76726,Science Fiction,Dune Entertainment,15000000,145000000,"Three high school students make an incredible discovery, leading to their developing uncanny powers beyond their understanding. As they learn to control their abilities and use them to their advantage, their lives start to spin out of control, and their darker sides begin to take over.",2012-02-01
Safe House,59961,Action,Universal Pictures,85000000,208076205,"A dangerous CIA renegade resurfaces after a decade on the run. When the safe house he's remanded to is attacked by mercenaries, a rookie operative escapes with him. Now, the unlikely allies must stay alive long enough to uncover who wants them dead.",2012-02-09
American Reunion,71552,Comedy,Universal Pictures,50000000,234989584,"The characters we met a little more than a decade ago are returning to East Great Falls for their high-school reunion. In one long-overdue weekend, they will discover what has changed, who hasn’t and that time and distance can’t break the bonds of friendship. It was summer 1999 when four small-town Michigan boys began a quest to lose their virginity. In the years that have passed, Jim and Michelle married while Kevin and Vicky said goodbye. Oz and Heather grew apart, but Finch still longs for Stifler’s mom. Now these lifelong friends have come home as adults to reminisce about – and get inspired by – the hormonal teens who launched a comedy legend.",2012-04-04
Moonrise Kingdom,83666,Comedy,Focus Features,16000000,68263166,"Set on an island off the coast of New England in the summer of 1965, Moonrise Kingdom tells the story of two twelve-year-olds who fall in love, make a secret pact, and run away together into the wilderness. As various authorities try to hunt them down, a violent storm is brewing off-shore – and the peaceful island community is turned upside down in more ways than anyone can handle.",2012-05-16
Sexual Chronicles of a French Family,112160,Comedy,Toloda,0,0,Three generations of a French family open up about their sexual experiences and desires after young Romain is caught masturbating in his biology class.,2012-05-09
Brave,62177,Animation,Pixar,185000000,538983207,"Brave is set in the mystical Scottish Highlands, where Mérida is the princess of a kingdom ruled by King Fergus and Queen Elinor. An unruly daughter and an accomplished archer, Mérida one day defies a sacred custom of the land and inadvertently brings turmoil to the kingdom. In an attempt to set things right, Mérida seeks out an eccentric old Wise Woman and is granted an ill-fated wish. Also figuring into Mérida’s quest — and serving as comic relief — are the kingdom’s three lords: the enormous Lord MacGuffin, the surly Lord Macintosh, and the disagreeable Lord Dingwall.",2012-06-21
Wrong Turn 5: Bloodlines,125509,Horror,20th Century Fox Home Entertainment,0,0,"A small West Virginia town is hosting the legendary Mountain Man Festival on Halloween, where throngs of costumed party goers gather for a wild night of music and mischief. But an inbred family of hillbilly cannibals kill the fun when they trick and treat themselves to a group of visiting college students.",2012-10-23
Taken 2,82675,Action,EuropaCorp,45000000,376141306,"In Istanbul, retired CIA operative Bryan Mills and his wife are taken hostage by the father of a kidnapper Mills killed while rescuing his daughter.",2012-09-27
Man on a Ledge,49527,Action,Di Bonaventura Picture,42000000,46221189,"An ex-cop turned con threatens to jump to his death from a Manhattan hotel rooftop. The NYPD dispatch a female police psychologist to talk him down. However, unbeknownst to the police on the scene, the suicide attempt is a cover for the biggest diamond heist ever pulled.",2012-01-13
The Dictator,76493,Comedy,Four By Two Productions,65000000,179379533,The heroic story of a dictator who risks his life to ensure that democracy would never come to the country he so lovingly oppressed.,2012-05-15
Journey 2: The Mysterious Island,72545,Adventure,Walden Media,79000000,355692760,"Sean Anderson partners with his mom's boyfriend on a mission to find his grandfather, who is thought to be missing on a mythical island.",2012-01-19
Silent Hill: Revelation 3D,61012,Thriller,Konami Corporation Ltd.,20000000,52302796,"Heather Mason and her father have been on the run, always one step ahead of dangerous forces that she doesn't fully understand, Now on the eve of her 18th birthday, plagued by horrific nightmares and the disappearance of her father, Heather discovers she's not who she thinks she is. The revelation leads her deeper into a demonic world that threatens to trap her forever.",2012-10-10
Jack Reacher,75780,Crime,Paramount,60000000,218340595,"In an innocent heartland city, five are shot dead by an expert sniper. The police quickly identify and arrest the culprit, and build a slam-dunk case. But the accused man claims he's innocent and says ""Get Jack Reacher."" Reacher himself sees the news report and turns up in the city. The defense is immensely relieved, but Reacher has come to bury the guy. Shocked at the accused's request, Reacher sets out to confirm for himself the absolute certainty of the man's guilt, but comes up with more than he bargained for.",2012-12-20
Secret of the Wings,75258,Animation,Walt Disney Animation Studios,0,0,Tinkerbell wanders into the forbidden Winter woods and meets Periwinkle. Together they learn the secret of their wings and try to unite the warm fairies and the winter fairies to help Pixie Hollow.,2012-08-17
The Bourne Legacy,49040,Action,Dentsu,130000000,276572938,"New CIA operative, Aaron Cross experiences life-or-death stakes that have been triggered by the previous actions of Jason Bourne.",2012-08-08
Dredd,49049,Action,Rena Film,50000000,41037742,"In the future, America is a dystopian wasteland. The latest scourge is Ma-Ma, a prostitute-turned-drug pusher with a dangerous new drug and aims to take over the city. The only possibility of stopping her is an elite group of urban police called Judges, who combine the duties of judge, jury and executioner to deliver a brutal brand of swift justice. But even the top-ranking Judge, Dredd, discovers that taking down Ma-Ma isn’t as easy as it seems in this explosive adaptation of the hugely popular comic series.",2012-09-07
Mirror Mirror,62764,Adventure,Misher Films,85000000,183018522,"After she spends all her money, an evil enchantress queen schemes to marry a handsome, wealthy prince. There's just one problem - he's in love with a beautiful princess, Snow White. Now, joined by seven rebellious dwarves, Snow White launches an epic battle of good vs. evil...",2012-03-15
Underworld: Awakening,52520,Fantasy,Screen Gems,70000000,160112671,"After being held in a coma-like state for fifteen years, vampire Selene learns that she has a fourteen-year-old vampire/Lycan hybrid daughter named Nissa, and when she finds her, they must stop BioCom from creating super Lycans that will kill them all.",2012-01-19
Argo,68734,Drama,GK Films,44500000,232324128,"As the Iranian revolution reaches a boiling point, a CIA 'exfiltration' specialist concocts a risky plan to free six Americans who have found shelter at the home of the Canadian ambassador.",2012-10-11
The Pirates! In an Adventure with Scientists!,72197,Animation,Sony Pictures Animation,60000000,118338361,"The luxuriantly bearded Pirate Captain is a boundlessly enthusiastic, if somewhat less-than-successful, terror of the High Seas. With a rag-tag crew at his side, and seemingly blind to the impossible odds stacked against him, the Captain has one dream: to beat his bitter rivals Black Bellamy and Cutlass Liz to the much coveted Pirate of the Year Award. It’s a quest that takes our heroes from the shores of exotic Blood Island to the foggy streets of Victorian London. Along the way they battle a diabolical queen and team up with a haplessly smitten young scientist, but never lose sight of what a pirate loves best: adventure!",2012-03-12
Hotel Transylvania,76492,Animation,Columbia Pictures,85000000,358375603,"Welcome to Hotel Transylvania, Dracula's lavish five-stake resort, where monsters and their families can live it up and no humans are allowed. One special weekend, Dracula has invited all his best friends to celebrate his beloved daughter Mavis's 118th birthday. For Dracula catering to all of these legendary monsters is no problem but the party really starts when one ordinary guy stumbles into the hotel and changes everything!",2012-09-20
A Royal Affair,88273,Drama,Sirena Film,8000000,7594693,"A young queen falls in love with her physician, and they start a revolution that changes their nation forever.",2012-03-29
Stolen,127493,Action,Millennium Films,35000000,2106557,"A former thief frantically searches for his missing daughter, who has been kidnapped and locked in the trunk of a taxi.",2012-05-17
Lockout,81796,Action,Ciné+,20000000,32204030,"Set in the near future, Lockout follows a falsely convicted ex-government agent , whose one chance at obtaining freedom lies in the dangerous mission of rescuing the President's daughter from rioting convicts at an outer space maximum security prison.",2012-04-12
The Master,68722,Drama,Annapurna Pictures,32000000,28258060,"Freddie, a volatile, heavy-drinking veteran who suffers from post-traumatic stress disorder, finds some semblance of a family when he stumbles onto the ship of Lancaster Dodd, the charismatic leader of a new ""religion"" he forms after World War II.",2012-09-07
What to Expect When You're Expecting,76494,Romance,Lionsgate,40000000,79700000,"Challenges of impending parenthood turn the lives of five couples upside down. Two celebrities are unprepared for the surprise demands of pregnancy; hormones wreak havoc on a baby-crazy author, while her husband tries not to be outdone by his father, who's expecting twins with his young trophy wife; a photographer's husband isn't sure about his wife's adoption plans; a one-time hook-up results in a surprise pregnancy for rival food-truck owners.",2012-05-17
Wrath of the Titans,57165,Fantasy,Thunder Road Pictures,150000000,301000000,"A decade after his heroic defeat of the monstrous Kraken, Perseus-the demigod son of Zeus-is attempting to live a quieter life as a village fisherman and the sole parent to his 10-year old son, Helius. Meanwhile, a struggle for supremacy rages between the gods and the Titans. Dangerously weakened by humanity's lack of devotion, the gods are losing control of the imprisoned Titans and their ferocious leader, Kronos, father of the long-ruling brothers Zeus, Hades and Poseidon.",2012-03-27
The Vow,72570,Drama,Spyglass Entertainment,30000000,196114570,"Happy young married couple Paige and Leo are, well, happy. Then a car accident puts Paige into a life-threatening coma. Upon awakening she has lost the previous five years of memories, including those of her beloved Leo, her wedding, a confusing relationship with her parents, or the ending of her relationship with her ex-fiance. Despite these complications, Leo endeavors to win her heart again and rebuild their marriage.",2012-02-05
Casa De Mi Padre,80304,Comedy,Lions Gate,0,0,"Scheming of a way to save their father's ranch, the Alvarez brothers find themselves in a war with Mexico's most feared drug lord.",2012-03-15
The Lorax,73723,Animation,Universal Pictures,70000000,348840316,"A 12-year-old boy searches for the one thing that will enable him to win the affection of the girl of his dreams. To find it he must discover the story of the Lorax, the grumpy yet charming creature who fights to protect his world.",2012-03-01
Contraband,77866,Thriller,Universal Pictures,25000000,63100000,"When his brother-in-law runs afoul of a drug lord, family man Chris Farraday turns to a skill he abandoned long ago – smuggling – to repay the debt. But the job goes wrong, and Farraday finds himself wanted by cops, crooks and killers alike.",2012-01-12
Diary of a Wimpy Kid: Dog Days,82650,Comedy,Fox 2000 Pictures,10000000,0,"School is out and Greg is ready for the days of summer, when all his plans go wrong. What on earth is he going to do all summer?",2012-08-02
I Want You,109689,Drama,Zeta Audiovisual,0,0,"Sequel to ""Three Steps Above Heaven"". The sexy Gin (Clara Lago) is the new love of Hache (Mario Casas), but this can not forget his former girlfriend (Maria Valverde), so the love triangle is inevitable.",2012-06-22
Sinister,82507,Horror,Automatik Entertainment,3000000,77712439,"Found footage helps a true-crime novelist realize how and why a family was murdered in his new home, though his discoveries put his entire family in the path of a supernatural entity.",2012-03-29
John Dies at the End,75761,Horror,Magnet Releasing,0,0,"A new drug promises out-of-body experiences, but users are coming back changed forever, and an otherworldly invasion of Earth is underway.",2012-01-23
The Cold Light of Day,77948,Action,Film Rites,20000000,16863583,"After his family is kidnapped during their sailing trip in Spain, a young Wall Street trader is confronted by the people responsible: intelligence agents looking to recover a mysterious briefcase.",2012-04-04
Safe,72387,Action,IM Global,30000000,40346186,"After a former elite agent rescues a 12-year-old Chinese girl who's been abducted, they find themselves in the middle of a standoff between Triads, the Russian Mafia and high-level corrupt New York City politicians and police.",2012-04-16
Frankenweenie,62214,Animation,Tim Burton Productions,39000000,35287788,"When a car hits young Victor's pet dog Sparky, Victor decides to bring him back to life the only way he knows how. But when the bolt-necked ""monster"" wreaks havoc and terror in the hearts of Victor's neighbors, he has to convince them that Sparky's still the good, loyal friend he was.",2012-10-04
Wanderlust,50647,Comedy,Relativity Media,35000000,24159934,"Rattled by sudden unemployment, a Manhattan couple surveys alternative living options, ultimately deciding to experiment with living on a rural commune where free love rules.",2012-02-23
This Means War,59962,Action,Dune Entertainment,65000000,156974557,Two top CIA operatives wage an epic battle against one another after they discover they are dating the same woman.,2012-02-14
Disconnect,127517,Drama,Lionsgate,10000000,3428048,"Disconnect interweaves multiple storylines about people searching for human connection in today’s wired world. Through poignant turns that are both harrowing and touching, the stories intersect with surprising twists that expose a shocking reality into our daily use of technology that mediates and defines our relationships and ultimately our lives.",2012-09-11
Gambit,97434,Comedy,CBS Films,0,0,"An art curator decides to seek revenge on his abusive boss by conning him into buying a fake Monet, but his plan requires the help of an eccentric and unpredictable Texas rodeo queen.",2012-11-07
Lawless,82633,Crime,The Weinstein Company,26000000,53676580,"Set in the Depression-era Franklin County, Virginia, a bootlegging gang is threatened by authorities who want a cut of their profits.",2012-08-29
Seeking a Friend for the End of the World,88005,Comedy,Indian Paintbrush,10000000,9636289,"As an asteroid nears Earth, a man finds himself alone after his wife leaves in a panic. He decides to take a road trip to reunite with his high school sweetheart. Accompanying him is a neighbor who inadvertently puts a wrench in his plan.",2012-06-22
Bait,118957,Action,Screen Queensland,30000000,0,A freak tsunami traps shoppers at a coastal Australian supermarket inside the building ... along with a 12-foot great white shark.,2012-09-05
Step Up Revolution,85446,Music,Summit Entertainment,33000000,140470746,"Emily arrives in Miami with aspirations to become a professional dancer. She sparks with Sean, the leader of a dance crew whose neighborhood is threatened by Emily's father's development plans.",2012-07-26
Blue Lagoon: The Awakening,115290,Drama,PeaceOut Productions,0,0,Two high school students become stranded on a tropical island and must rely on each other for survival. They learn more about themselves and each other while falling in love.,2012-06-16
Alex Cross,94348,Action,Summit Entertainment,45000000,30353232,"After Washington DC detective Alex Cross is told that a family member has been murdered, he vows to track down the killer. He soon discovers that she was not his first victim and that things are not what they seem.",2012-10-18
Drug War,110410,Action,Milky Way Image Company,0,0,"The taciturn police commander Zhang leads an undercover drugs team and in his continuous battle against the ubiquitous drug barons, takes up arms against his arch enemy, Timmy Choi. When he gets hold of Choi, he makes a deal with him: in exchange for his life (in China you can get the death penalty for producing only 50 grams of drugs) the young criminal will help the police infiltrate a sizeable drug network.",2012-11-15
Columbus Circle,92000,Crime,G4 Pictures,10000000,0,An heiress who's been shut inside her apartment building for nearly two decades is forced to confront her fears after one of her neighbors is killed and a detective arrives to begin the investigation.,2012-03-05
Byzantium,102780,Drama,WestEnd Films,10000000,89237,"Two mysterious women seek refuge in a run-down coastal resort. Clara meets lonely Noel, who provides shelter in his deserted guesthouse, Byzantium. Schoolgirl Eleanor befriends Frank and tells him their lethal secret. They were born 200 years ago and survive on human blood. As knowledge of their secret spreads, their past catches up on them with deathly consequence.",2012-09-09
